Nr Pakietu,Czas,Źródłowy IP:Port,Docelowy IP:Port,Protokół,Informacja (Skrótowy Opis)
1,0.000000,192.168.1.100:54321,203.0.113.10:80,TCP,54321 → 80 [SYN] Seq=0 Win=65535 Len=0 MSS=1460
2,0.005120,203.0.113.10:80,192.168.1.100:54321,TCP,"80 → 54321 [SYN, ACK] Seq=0 Ack=1 Win=65535 Len=0"
3,0.005180,192.168.1.100:54321,203.0.113.10:80,TCP,54321 → 80 [ACK] Seq=1 Ack=1 Win=65535 Len=0
4,0.005500,192.168.1.100:54321,203.0.113.10:80,HTTP,GET /index.html HTTP/1.1
5,0.015000,203.0.113.10:80,192.168.1.100:54321,HTTP,HTTP/1.1 200 OK (text/html)
